<?xml version="1.0" encoding="UTF-8"?>
<!--

    Copyright 2014 deib-polimi
    Contact: deib-polimi <santo.lombardo@polimi.it>

       Licensed under the Apache License, Version 2.0 (the "License");
       you may not use this file except in compliance with the License.
       You may obtain a copy of the License at

           http://www.apache.org/licenses/LICENSE-2.0

       Unless required by applicable law or agreed to in writing, software
       distributed under the License is distributed on an "AS IS" BASIS,
       WITHOUT WARRANTIES OR CONDITIONS OF ANY KIND, either express or implied.
       See the License for the specific language governing permissions and
       limitations under the License.

-->
<!-- edited with XMLSpy v2011 sp1 (http://www.altova.com) by End User (free.org) -->
<xs:schema xmlns:xs="http://www.w3.org/2001/XMLSchema" elementFormDefault="qualified" attributeFormDefault="unqualified">
	<xs:element name="hdm">
		<xs:complexType>
			<xs:sequence minOccurs="0">
				<xs:element ref="child"/>
			</xs:sequence>
			<xs:attribute name="id" type="xs:ID" use="required"/>
		</xs:complexType>
	</xs:element>
	<xs:element name="relationship">
		<xs:complexType>
			<xs:sequence minOccurs="0">
				<xs:element name="attribute" minOccurs="0" maxOccurs="unbounded">
					<xs:complexType>
						<xs:attribute name="name" type="xs:ID" use="required"/>
					</xs:complexType>
				</xs:element>
				<xs:element ref="child" maxOccurs="unbounded"/>
			</xs:sequence>
			<xs:attribute name="id" type="xs:Name" use="required"/>
		</xs:complexType>
	</xs:element>
	<xs:element name="child">
		<xs:complexType>
			<xs:sequence>
				<xs:element name="attribute" minOccurs="0" maxOccurs="unbounded">
					<xs:complexType>
						<xs:attribute name="name" type="xs:NCName" use="required"/>
					</xs:complexType>
				</xs:element>
				<xs:element ref="relationship" minOccurs="0" maxOccurs="unbounded"/>
			</xs:sequence>
			<xs:attribute name="id" type="xs:Name" use="required"/>
		</xs:complexType>
	</xs:element>
</xs:schema>
